Sample,Source
"Comhairle bhreise
✔ B’úsáideach leat, b’fhéidir, riachtanais do ghnólachta a phlé le duine atá seachtrach don ghnólacht (m.sh. líonra áitiúil thacaíocht gnó) a bheidh in ann do ghnólacht a fheiceáil le ‘súile’ nua (agus neamhspleácha).
✔ Ina lán casann féadfaidh tú cuardach ar an idirlíon agus teacht ar an ábhar atá de dhíth agat (in aisce) agus gheobhaidh tú roinnt nasc tábhachtach sa bhróisiúr seo chun eolas a bhealaigh a thabhairt duit.
Do na gnólachtaí siúd atá ag iarraidh faisnéise níos mionsonraithe ar conas dul i gceann na ‘ hÉagsúlachta’ nó ar conas leanúint ar aghaidh lena bhfuil i mbun acu (‘Turas na hÉagsúlachta’), tá liosta seiceála na hÉagsúlachta agus treoracha le haghaidh réimsí tábhachtacha thíos anseo a thabharfaidh níos faide ar an mbealach seo thú agus tá níos mó eolas iontu ar na 8 leid a cuireadh síos orthu roimhe seo.
✔ Baineann roinnt FBManna úsáid as comhairleoir gnó as a n-institiúid airgeadais (banc nó urra) agus is féidir go bhfuil uinéirí agus bainisteoirí eile gnólachta ina bhfoinse úsáideach comhairle.
✔ Do mhicreaghnólachtaí agus dóibh siúd nach bhfuil ról foirmiúil Acmhainní Daonna acu, déan cinnte nach lorgann tú cuidiú nach labhraíonn ach faoi chur chuige‘Éagsúlachta’, ach cuidiú a cheanglaíonn an cur chuige agus na sochair a d’fhéadfadh sé tabhairt ar do ghnólacht trí chomhairle shainiúil phraiticiúil.
✔ Bíodh conradh a bhfuil muinín agat as mar thosú agat agus faigh amach cé atá san áit is fearr le cuidiú leat nó féach ar na hacmhainní ag deireadh an bhróisiúir seo agus lorg eolas teagmhála d’eagraíocht trádála nó do chomhlachas lucht trádála i do cheantar féin.
Tá a lán faisnéise le fáil in aisce, agus ise ba chóir duit a úsáid ar dtús!
✔ Má bhaineann tú feidhm as duine sainiúil taobh amuigh den ghnólacht a thairgeann tacaíocht, tabhair air coinneáil leis an bpróiseas maidir le athrú ar bith (m.sh. bheith i do pháirt de phróiseas an agallaimh) a chur i bhfeidhm agus measúnú a thabhairt faoi cé chomh rathúil is a bhí an cur chuige.
","OPUS QED, lines 4325 to 4334"
"Airteagal 123**
Cinnfidh an Chomhairle, ag gniomhú di tri thromlach cáilithe, tuarastail, slánaíochtaí agus pinsin Uachtarán agus chomhaltaí an
Airteagal mar atá arna chur isteach le hAirteagal 1(6), CAE.
Airteagal mar atá arna chur isteach le hAirteagal 1(7), CAE.
Choimisiúin agus Uachtarán, Bhreithiúna, Abhcóidí Ginearálta agus Chláraitheoir na Cúirte Breithiúnais.
Cinnfidh an Chomhairle chomh maith, tri thromlach cáilithe freisin, aon slánaíocht is intugtha ín ionad luach saothair.
Roinn 3
An Coimisiún
Airteagal 124
","OPUS QED, lines 18174 to 18183"
"Féadfar iad a atoghadh uair amháin.
CONRADH NICE
Aon Bhreitheamh déag a bheidh ar an Mór-Dhlísheomra.
Uachtarán na Cúirte a bheidh ina uachtarán air.
Is cuid den Mhór-Dhlísheomra freisin Uachtaráin na ndlísheomraí a bhfuil cúigear Breithiúna iontu agus Breithiúna eile arna gceapadh i gcomhréir leis na coinníollacha atá leagtha síos sna rialacha nós imeachta.
Suífidh an Chúirt mar Mhór-Dhlísheomra arna iarraidh sin do Bhallstát nó d'institiúid de chuid na gComhphobal is páirtí sna himeachtaí.
Suífidh an Chúirt mar chúirt iomlán nuair a thugtar cásanna os a comhair de bhun Airteagal 195(2), Airteagal 213(2), Airteagal 216 nó Airteagal 247(7) de Chonradh CE nó Airteagal 107d(2), Airteagal 126(2), Airteagal 129 nó Airteagal 160b(7) de Chonradh CEFA.
Fairis sin, nuair a mheasann sí go bhfuil mórthábhacht ag roinnt le cas os a comhair, féadfaidh an Chúirt a chinneadh, tar éis an tAbhcóide Ginearálta a éisteacht, an cas a tharchur chuig an gcúirt iomlán.
Airteagal 17
","OPUS QED, lines 20917 to 20926"
"TEIDEAL A TRI
Forálacha Eacnamaíocha agus Sóisialta
CAIBIDIL
FORÁLACHA GINEARÁLTA
Airteagal 46
Féadfaidh an tArdÚdarás, tráth ar bith, dui i gcomhairle le Rialtais, leis na páirtithe éagsúla a bheidh i geeist (gnóthais, oibrithe, úsáidirí agus déileálaithe) agus lena gcomhlachaís, agus le saíneolaithe ar bith.
Beidh gnóthais, oibrithe, úsáidirí agus déileálaithe, agus a gcomh lachaís, i dteideal meabhraíochtaí no barúlacha ar bith a chur i láthair an Ard-Údaráis i dtaobh ceisteanna is cúram leo.
Chun treoireacht a thabhairt. i ndáil leis na cúraimí a chuirtear ar an gComhphobal. maidir leis an ngníomhaíocht is indéanta ag gach n-aon lena mbaíneann. agus chun a réim ghníomhaiochta féin a chin neadh. de réir forálacha an Chonartha seo. déanfaidh an tArdÚdarás tar éis comhairle a ghlacadh mar atá limite timas:
/. staidéar a choimeád á dhéanamh ar fiíorás margaí agus ar threo na bpraghsanna:
","OPUS QED, lines 6336 to 6345"
"Úráiniam nádúrtha, amh nó próiseáilte.
Cóimhiotail ina bhfuil plútóiniam.
Comhdhúile orgánacha nó neamhorgánacha d'úráiniam saibhrithe i gcomhdhúile orgánacha nó neamhorgánacha d'úráiniam-235.
Comhdhúile orgánacha nó neamhorgánacha d'úráiniam-233.
Tóiriam saibhrithe in úráiniam-233.
Comhdhúile orgánacha nó neamhorgánacha de phlútóiniam.
Úráiniam saibhrithe i bplútóiniam.
Úráiniam saibhrithe in úráiniam-235.
Cóimhiotail ina bhfuil úráiniam saibhrithe in úráiniam-235 nó úráiniam-233.
","OPUS QED, lines 2665 to 2674"
"Na hoifigigh don Choimisiún a mbeidh cúraimí maoirseachta curtha aige orthu, beidh acu, i gcríocha na mBallstát agus chomh fada riamh agus ís gá chun a gcúram a chomhlíonadh, na cearta agus na cumhachtai a thugann na Stáit sin lena reachtaíocht dá n-oifigigh ioncaim féin.
Cuirfear i bhfios go cui don Stát lena mbaineann cúraimí maoirseachta agus stádas na n-oifigeach sin.
Féadfaidh oifigigh don Stát sin, ar iarratas uaidh féin nó ón g Co i misiún, cuidiú le hoifigigh an Choimisiúin i gcomhlíonadh a gcúraim.
Airteagal 87
Gabhann na hArdpháirtithe Conarthacha orthu féin gan leas a bhaint as aon chonartha!, choinbhinsiúin ná dearbhuithe atá déanta eatarthu chun go gcuirfidh siad díospóid maidir le léiriú nó feidhmiú an Chonartha seo á réiteach ar mhodh ar bith seachas mar a fhoráiltear ann.
Airteagal 88
Má mheasann an Coimisiún gur mhainnigh Stát oibleagáid atá air faoin gConradh seo a chomhlíonadh, cuirfidh sé an mhain-
neachtain sin ar taifead i gcinneadh réasúnaithe, tar éis caoi a thabhairt don Stát sin a bharúlacha a chur faoina bhráid.
Sonróidh sé don Stát atá i geeist tréimhse áirithe chun a oibleagáid a chomh líonadh.
","OPUS QED, lines 16294 to 16303"
"Toghfaidh na Breithiúna Uachtaráin na ndlísheomraí as a líon féin.
Toghfar Uachtaráin na ndlísheomraí a bhfuil cúigear Breithiúna iontu go ceann téarma trí bliana.
Féadfar iad a atoghadh uair amháin.
Beidh comhdhéanamh na ndlísheomraí agus sannadh na gcásanna dóibh faoi rialú ag na rialacha nós imeachta.
I gcásanna áirithe atá sainithe sna rialacha nós imeachta, féadfaidh an Chúirt Ghinearálta suí mar chúirt iomlán nó féadfar í a chomhdhéanamh de Bhreitheamh aonair.
Féadfar a fhoráil sna rialacha nós imeachta go bhféadfaidh an Chúirt Ghinearálta suí mar Mhór-Dhlísheomra sna cásanna agus faoi na coinníollacha atá sonraithe iontu.
Airteagal 51
De mhaolú ar an riail atá leagtha síos in Airteagal 256(1) den Chonradh ar Fheidhmiú an Aontais Eorpaigh, forchoimeádtar dlínse chuig an gCúirt Bhreithiúnais sna caingne dá dtagraítear in Airteagail 263 agus 265 den Chonradh ar Fheidhmiú an Aontais Eorpaigh nuair a thionscnaíonn Ballstát iad:
(a) i gcoinne gnímh nó neamhghnímh de chuid Pharlaimint na hEorpa nó na Comhairle, nó de chuid an dá institiúid sin ag gníomhú dóibh go comhpháirteach, seachas:
","OPUS QED, lines 3016 to 3025"
"Gan dochar dá chearta féin i gcoinne an duine atá freagrach sa damáiste, gheobhaidh an Comhphobal, sa mhéid go mbeidh sé tar éis damáiste den sórt sin a shlánú, aon chearta caingne a bhí acu siúd lena mbaineann i gcoinne tríú páirtithe.
Ní dhéanfaidh sé sin difear do cheart an Chomhphobail chun imeachtaí a bhunú i gcoinne an duine atá freagrach sa damáiste de réir na bhforálacha ginearálta a bheidh i bhfeidhm.
Airteagal 29
Más md é, i gcás comhaontú nó conradh chun faisnéis eolaíochta nó tionscail sa réimse núicléach a mhalartú idir Ballstát, duine nó gnóthas ar thaobh amháin, agus tríú Stát, eagraíocht idirnáisiúnta nó náisiúnach de thríú Stát ar an taobh eile, gur gá, ar thaobh nó ar thaobh eile, síniú Stáit ag gniomhú dó ina cháil fhlaithiúnta, is é an Coimisiún a thabharfaidh i gcrích é.
Faoi réir fhorálacha Airteagail 103 agus 104, féadfaidh an Coimisiún, áfach, ar cibé coinniollacha is iomchuí leis, a údarú do Bhallstát, do dhuine nó do ghnóthas comhaontuithe den sórt sin a thabhairt i gcrích.
CAIBIDIL 3
SLAINTE AGUS SABHAILTEACHT
Airteagal 30
Leagfar síos sa Chomhphobal bunchaighdeáin chun sláinte oibrithe agus an phobail i gcoitinne a chosaint ar na contúirtí ó radaíochtaí ianúcháin.
","OPUS QED, lines 17704 to 17713"
"Mura mbionn na meánrátaí a bhunóidh Ballstát i gcomhréir leis na prionsabail sin, eiseoidh an Coimisiún treoracha nó cinntí iomchuí chuig an Stát sin.
Airteagal 98
I gcás muirear seachas cánacha láimhdeachais, dleachtanna máil agus cineálacha eile cánachais indirigh, ní cead maithiúnais ná aisíocaiochtaí i leith onnmhairí go Ballstáit eile a dheonú ná ní cead muirir frithchúitimh i leith allmhairí ó Bhallstáit a fhorchur mura mbeidh na bearta a mheabhraítear formheasta roimh ré go ceann tréimhse teoranta ag an gComhairle, ag gniomhú di tri thromlach cáilithe ar thogra ón gCoimisiún.
Airteagal 99
Féachfaidh an Coimisiún conas is féidir, ar mhaithe leis an gcómhargadh, comhchuibhiú a dhéanamh ar reachtaíocht na mBallstát éagsúil maidir le cánacha láimhdeachais, dleachtanna máil agus cineál acha eile cánachais indírigh, lena náirítear bearta frithchúitimh is inchurtha chun feidhme ar thrádáil idir Ballstáit.
Cuirfidh an Coimisiún tograí faoi bhráid na Comhairle, agus gníomhóidh an Chomhairle orthu d'aontoil gan dochar d'fhorálacha Airteagail 100 agus 101.
CAIBIDIL
DLÍTHE A CHOMHFHOGASU
Airteagal 100
","OPUS QED, lines 8068 to 8077"
