Sample,Source
"Déanfar an Conradh ag bunú an Chomhphobail Eorpaigh do Ghual agus Cruach a leasú i gcomhréir le forálacha an Airteagail seo.
In Airteagal 10, cuirtear an méid seo a leanas in ionad mhír 2:
Ainmneoidh an Chomhairle, ag teacht le chéile di i dtionól na gCeannairí Stáit nó Rialtais, an duine a bheartaíonn siad a cheapadh ina Uachtarán ar an gCoimisiún; déanfaidh Parlaimint na hEorpa an t-ainmniúchán a fhormheas.
Glacfaidh an Chomhairle, ag gníomhú di tri thromlach cáilithe agus de chomhthoil leis an ainmnitheach do phost an Uachtaráin, liosta na ndaoine eile a bheartaíonn siad a cheapadh ina gcomhaltaí den Choimisiún, arna tharraingt suas i gcomhréir leis na tograí arna ndéanamh ag gach Ballstát.
Déanfar Uachtarán agus comhaltaí eile an Choimisiúin arna n-ainmniú amhlaidh a chur mar choláiste faoi réir vota formheasta ag Parlaimint na hEorpa.
Ceapfaidh an Chomhairle, ag gníomhú di tri thromlach cáilithe, Uachtarán agus comhaltaí eile an Choimisiúin tar éis fhormheas Pharlaimint na hEorpa.""
Cuirtear an méid seo a leanas in ionad Airteagal 11:
""Airteagal 11
Oibreoidh an Coimisiún faoi threoir pholaitiúil a Uachtaráin agus cinnfidh sé a eagrúchán inmheánach d'fhonn comhchuibheas, éifeachtacht agus coláisteacht a ghníomhaíochta a áirithiú.
","OPUS QED, lines 20616 to 20625"
"— fréamshamhla d'ionstraimí cuardaigh; — mianreolaíocht; — radaibhitheolaíocht; c) biúró caighdeán, ag sainfheidhmiú i dtomhais núicléacha chun iseatóipí a anailísiú agus i dtomhais absolóideacha na radaíochta agus an ionsúite ar neodróin, le himoibritheoir turgnamhach dá chuid féin.
Doiciméadacht, faisnéis agus teagasc.
Déanfaidh an tAirmheán Comhpháirteach socrú chun faisnéis a mhalartú ar mhórchóir, go háirithe sna réimsí seo a leanas:
— amhábhair: modhanna cuardaigh, mianadóíreachta, tiubhacháin, claochlaithe, saothraithe, etc.;
— fisic a chur chun feidhme ar fhuinneamh núicléach ;
— ceimíc fhisicíúil imoibritheoirí;
— próiseáil ar ábhair radaíghníomhacha;
— feidhmeanna rada-iseatóipí.
Eagróidh an tAirmheán Comhpháirteach sainchúrsaí chun cuardóirí a thraenáil agus i dtaobh feidhmeanna rada-iseatóipí.","OPUS QED, lines 11762 to 11771"
"Airteagal 26
I gcás ina ndearnadh faisnéis lena mbaineann paitinní. iarratais ar phaitinni. cearta paitinne atá cosanta go sealadach. cuspai áisiúlachta nó iarratais ar chuspaí áisiúlachta a rúnaicmiú de réir Airteagal 24 agus 25, ní fhéadfaidh na Stáit a d'iarr an rúnaicmiú sin diúltú cead a thabhairt a samhail d'iarratais a chomhadú sna Ballstáit eile.
Déanfaidh gach Ballstát na bearta is gá chun na cearta agus na hiarratais sin a choimeád faoi shlándáil de reirán nós imeachta atá leagtha síos ina dhlíthe agus ina rialacháin féin.
Ní fhéadfar aon iarratais a bhaineann le faisnéis atá rúnaiemithe de réir Airteagal 24 a chomhadú lasmuigh de na Ballstáit ach amháin lena n-aontoilíocht.
Mura gcuirfidh Ballstáit a seasamh in iúl, measfar a dtoiliú a bheith faighte ar shé mhí a bheith caite ón data a chuir an Coimisiún an fhaisnéis i bhfios do na Ballstáit.
Airteagal 27
Beidh an cúiteamh i leith aon damáiste a bhain don iarratasóir de dhroim rúnaicmiú ar chúiseanna cosanta faoi réir forálacha dlithe
náisiúnta na mBallstát agus luífidh a fhreagracht ar an Stát a d'iarr an rúnaicmiú sin nó a fuair uasghnidú nó fadú aran rúnaicmiú nó a chuir faoi deara go dtoirmiscfí comhadú iarratas lasmuigh den Chomhphobal.
I gcás ina mbeidh roinnt Ballstát tar éis uasghrádú nó fadú a fháil ar an rúnaicmiú nó inar chuir siad faoi deara go dtoirmiscfí comhadú iarratas lasmuigh den Chomhphobal beidh siad freagrach i gcomhpháirt in aon damáiste a shlánú a tharla dá bhíthin sin.","OPUS QED, lines 10560 to 10569"
"In aon chás ina gceanglaítear ar an Ard-Údarás leis an gConradh seo. nó le rialacha a bheidh leagtha sios chun a churtha i ngníomh. cinneadh a ghlacadh nó moladh a thabhairt agus nach gcomhlíonfaidh sé an oibleagáid sin. is do na Stáit. don Chomhairle. do na gnóthais nó do na comhlachais. de réir mar a bheidh. é sin a thabhairt os comhair an Ard-Údaráis.
Bainfidh an fhoráil chéanna leis an gcás ina gcumhachtaítear don Ard-Údarás leis an gConradh seo, nó le rialacha a bheidh leagtha síos chun a churtha i ngníomh, cinneadh a ghlacadh nó moladh a thabhairt agus go staonfaidh sé óna dhéanamh agus gur mí-úsáid chumhachtaí an staonadh sin.
Más rud é, tar éis tréimhse dhá mhi, go mbeidh an tArdÜdarás gan aon chinneadh a ghlacadh ná aon mholadh a thabhairt, féadfar achomharc a thionscnamh os comhair na Cúirte, laistigh de mhi, in aghaidh an diúltú is intuigthe a bheith tugtha ag an Ard-Üdarás tri fhanacht ¡na thost i dtaobh an chais.
Airteagal 36
Sula ndéanfaidh an tArdÚdarás smachtbhanna airgid nó íocaíocht phionósach thréimhsiúil a fliorchur mar a fhoráiltear sa Chonradh seo, dlífidh an tArdÚdarás caoi a thabhairt don pháirtí lena mbaineann a bharúlacha a chur faoina bhráid.
Beidh dlinse neamhtheoranta ag an gCúirt in achomhairc in aghaidh smachtbhannai airgid agus íocaíochtaí pionósacha tréímhsiúla a forchuireadh faoin gConradh seo.
I dtacaíocht lena achomharc, féadfaidh páirtí, faoi choinníollacha na chéad mhíre d'Airteagal 33 den Chonradh seo, dlíthiúlacht an chinnte nó an mholta a líomhnaítear a bheith gan comhlíonadh ag an bpáirtí sin a chonspóid.
Airteagal 37
Má mheasann Ballstát gníomh nó neamhgníomh ag an Ard-Üdarás a bheith, i gcás áirithe, de chineál a thabharfaidh suaití bunúsacha seasmhacha ina gheilleagar, féadfaidh sé an t-ábhar a thabhairt os comhair an Ard-Údaráis.","OPUS QED, lines 6299 to 6308"
"Ag aimsiú dea-shonraí ar dhramhaíl leictreach agus leictreonach
In ainneoin na ndeacrachtaí a bhaineann le haimsiú, ceadú agus anailísiú na sonraí um dhramhaíl is amhlaidh go bhfuil an EEA tar éis anailís
Tá corpas reachtaíochta ag an Eoraip maidir le lastas na dramaíola guaisí agus dofhuascailte.
Teastaíonn tuilleadh fianaise ámh i leith éifeachtacht na reachtaíochta chun an brú ar an gcomhshaol a mhaolú.
Is cás tábhachtach í an dramhaíl leictreonach, a mheastar bheith ina dhramhaíl ghuaiseach.
Is minic a dhíchóimeáiltear í san Afraic agus san Áise gan mórán trealaimh chosanta pearsanta ná beart rialála truaillithe nó gan aon trealamh ná beart den sórt sin a bheith ann.
Is minic a dhóitear na comhpháirteanna amuigh faoin aer le miotail a aisghabháil, agus is iondúil go
Tá gach cineál dramhaíola faoi lán seol.
Tá ualaigh mhéadaitheacha, go háirithe an dramhpháipéar, na plaistigh agus na miotail á mbogadh ó thíortha forbartha chuig tíortha nach mbíonn na caighdeáin chomhshaoil chomh dian céanna iontu.
","OPUS QED, lines 933 to 942"
"Bheidh a dhóthain féin de sholáthar uibheacha sa Chomhphobal méadaithe ionas gur dócha gur cúrsai inmheánacha margaidh, agus nach bearta i leith allmhairí a shocróidh praghsanna.
Aran ábhar gur fior sin cheana féin maidir leis an gComhphobal mar ala. agus maidir leis an Ríocht Aontaithe. d'fhéadfadh go dtarlódh athrú sna praghsanna ar mhargadh an Chomhphobail mhéadaithe sa dóigh chéanna agus a tharlaíonn sna margaí éagsúla i láthair na huaire, ar a shon go dtiocfadh dó a bheith beagán níos fairsinge.
Ar an taobh eile, an lé atá ann i dtreo an táirgiocht a dhlúthú isteach i lámha saintáirgeoirl, fara forbairtí comhthreomhara sa mhargaíocht, ba chóir go mbeadh d'éifeacht
leo laghdú a thabhairt ar an neamhchobhsaiocht amach anseo.
Creídim dá bhrí sin go bhféadfaimid sinn féin a chur in inmhe do rialacha an Chomhphobail.
Más féidir Iibh a dhaingniú go foírmiúil anois go bhfuil an bonn ceart tuisceana eadrainn i dtaobh a mbeidh ar ár gcumas amach anseo i gcás an bhainne, más féidir libh glacadh leis na tuairimí atá luaite agam ar thábhacht agus ar shainghnéithe mhargadh an bhagúin i gComhphobal méadaithe agus a aithint gur mhaith an rud an chobhsaíocht i gcás muiceola agus uibheacha, féadfaimidne a dheimhniú duit, ónar dtaobhna de, nach gá dúinn a thuilleadh ceisteanna a ardú ar na hábhair sin le linn na gcaibidlí, ach amháin i gcomhthéacs ginearálta na gcomhshocruithe idirthréimhseacha.
Ráiteas ón Uasal W. Scheel, Aire Gnóthaí Eachtracha Phoblacht Chónaidhme na Gearmáine, thar ceann toscaireacht an Chomhphobail
Tá toscaireacht an Chomhphobail i bpáirt leis an taifeach a rinne tú maidir le haidhmeanna an chomhbheartais in earnáil na dtáirgí bainne agus ar ar féidir a dhéanamh faoi láthair maidir le praghas miondíola a shocrú do bhainne lena chaitheamh agus, thairis sin, maidir le gníomh aíochtaí de chuid eagraíochtaí neamhrialtasacha táirgeoirí.
Tugann sé chun cuimhne, a mhéid is gá, go mbaineann an bac ar bhearta náisiúnta ag ceadú ionannas praghsanna do na táirgí bainne éagsúla, atá mar choinníoll i Rialachán (CEE) Uimh.
","OPUS QED, lines 15262 to 15271"
"Déanfar, áfach, na dleachtanna dá dtagraítear san fhomhír roimhe seo a laghdú go comhleanúnach go leibhéal na ndleachtanna a fhorchuirtear ar tháirgi a allmhairítear ón mBallstát a bhfuil caidreamh speisialta ag gach tir nó críoch ar leith leis.
Bainfidh céatadáin agus tráthchlár na laghduithe dá bhforáiltear faoin gConradh seo leis an difríocht idir an dleacht a fhorchuirtear ar tháirge ón mBallstát a bhfuil caidreamh
speisialta aige leis an tir nó an chríoch áirithe agus an dleacht a fhorchuirtear ar an táirge céanna ó laistigh den Chomhphobal, ar a theacht isteach i dtír nó i geríoch a allmhairíthe.
Ni bhainfidh mir 2 leis na tíortha agus na críocha a dhéanann cheana féin, mar gheall ar na hoibleagáidí idirnáisiúnta áirithe atá de cheangal orthu, taraif chustam neamhidirdhealaitheach a chur chun feidhme ar theacht i bhfeidhm don Chonradh seo.
Má thugtar isteach nó má athraítear ar dhóigh ar bith dleachtanna custam ar earraí a allmhairítear isteach sna tíortha agus sna críocha, ní bheidh sin ina chúis, ó dhlí ná ó ghníomh, le haon idirdhealú, díreach ná ¡ndíreach, a dhéanamh idir allmhairí ó na Ballstáit éagsúla.
Airteagal 134
I gcás na dleachtanna is inchurtha ar earraí ó thríú tir, ar a dteacht isteach i dtír nó i geríoch, a bheith ar leibhéal ar cosúii dó, nuair a chuirtear forálacha Airteagal 133(1) chun feidhme, trádáil a shraonadh chun dochair d'aon Bhallstát, féadfaidh an Stát sin a iarraidh ar an gCoimisiún na bearta is gá mar leigheas ar an geor sin a mholadh do na Ballstáit eile.
Airteagal 135
Faoi réir na bhforálacha a bhaineann le sláinte phoiblí, slándáil phoiblí nó beartas poiblí, déanfar an tsaoirse ghluaiseachta laistigh de Bhallstáit le haghaidh oibrithe ó na tíortha agus na críocha, agus laistigh de na tíortha agus na críocha le haghaidh oibrithe ó na Ballstáit, a rialú Ie comhaontuithe a thabharfar í gcrích amach anseo Ie formheas d'aontoil ó na Ballstáit.
","OPUS QED, lines 8246 to 8255"
"Uimh. in Ainmníocht na Bruiscile
CAIBIDIL 1
Ainmhithe beo
CAIBIDIL 2
Feoil agus scartach feola inite
CAIBIDIL 3 lase, crústaigh agus moilisc
CAIBIDIL 4
Toradh déiríochta; uibheaclia éan; mil nádúrtha
CAIBIDIL 5
","OPUS QED, lines 9392 to 9401"
"Méadaíonn tiontú mórscála na bhforaoisí ina dtalamh arúil an cion sin agus tionchair thromchúiseacha aige sin ar an mbithéagsúlacht.
D’fhéadfadh an fiadhúlra agus cainníocht agus cáilíocht an uisce bheith thíos leis freisin má thiontaítear achar mór óna ngnáthóga nádúrtha nó ó cheantair fheirmeoireachta traidisiúnta isteach sa diantáirgeadh don bhithfhuinneamh.
Tionchair sofheicthe ríthábhachtach san iompar toisc a thuilleamaí ar an ola.
Tá an earnáil iompair ag méadú na nastuithe gáis cheaptha teasa agus ag ithe coigilteas astuithe a bhaineann na hearnálacha eile amach.
Tá an Coimisiún tar éis moladh dá réir sin go soláthróidh bithbhreoslaí 10 % den bhreosla iompair bhóithre faoin mbliain 2020, más féidir iad a dheimhniú mar chinn inbhuanaithe.
Léirítear sna sonraí ón mbliain 2007 go bhfuil an bithbhreosla mar 2.6 % den bhreosla iompair bhóithre san AE.
Is amhlaidh d'fhonn 10 % a bhaint amach nach foláir don Aontas Eorpach táirgeadh agus allmhairí an bhithbhreosla a mhéadú ag tráth ina bhfuil na bithbhreoslaí ag lár díospóireachtaí casta éiceolaíochta agus eacnamúla.
Tá níos mó díospóireachta timpeall sprioc bithbhreosla an AE.
Tá Parlaimint na hEorpa tar éis ráthaíocht a éileamh le déanaí go dtiocfaidh 40 % den sprioc 10 % ó fhoinsí nach mbeidh in iomaíocht leis an táirgeadh bia.
","OPUS QED, lines 843 to 852"
"Iris Oifigiúil an Aontais Eorpaigh
PRÓTACAL MAIDIR LE RÓL NA bPARLAIMINTÍ NÁISIÚNTA SAN AONTAS EORPACH
TÁ NA hARDPHÁIRTITHE CONARTHACHA,
AG MEABHRÚ DÓIBH gur ceist a bhaineann le heagrúchán agus le cleachtas bunreachtúil gach Ballstáit é an dóigh a ndéanann na Parlaimintí náisiúnta grinnscrúdú ar a rialtas féin i ndáil le gníomhaíochtaí an Aontais Eorpaigh,
ÓS MIAN LEO níos mó rannpháirtíocht i ngníomhaíochtaí an Aontais Eorpaigh a chothú sna Parlaimintí náisiúnta agus feabhas a chur ar a n-ábaltacht a ndearcadh a nochtadh ar dhréachtghníomhartha reachtacha an Aontais Eorpaigh agus ar ábhair eile a bhfuil suim ar leith acu iontu,
TAR ÉIS COMHAONTÚ ar na forálacha seo a leanas, a chuirfear i gceangal leis an gConradh ar an Aontas Eorpach, leis an gConradh ar Fheidhmiú an Aontais Eorpaigh agus leis an gConradh ag bunú an Chomhphobail Eorpaigh do Fhuinneamh Adamhach:
TEIDEAL I
FAISNÉIS LE hAGHAIDH NA bPARLAIMINTÍ NÁISIÚNTA
Airteagal 1
","OPUS QED, lines 2764 to 2773"
"Prótacal ar Reacht Chúirt Bhreithiúnais an Chomhphobail Eorpaigh do Fhuinneamh Adamhach
CHOMHPHOBAIL EORPAIGH DO FHUINNEAMH ADAMHACH,
Ós ΜΙΑΝ LEO Reacht na Cúirte dá bhforáiltear in Airteagal 160 den Chonradh seo a leagan síos,
TAR ÉIS na daoine seo a leanas a cheapadh mar Lánchumhachtaigh chuige sin:
A SHOILSE RÍ NA MBEILGEACH:
An Barún J. Ch.
SNOY ET D'OPPUERS, Ardrúnaí na hAireachta Gnóthaí Eacnamaíochta, Uachtarán Thoscaireacht na Beilge ag an gComhdháil Idir­Rialtasach;
UACHTARÁN PHOBLACHT CHÓNAIDHME NA GEARMÁINE:
An Dr. Carl Friedrich OPHÜLS, Ollamh, Ambasadóir Phoblacht Chónaidhme na Gearmáine, Uachtarán Thoscaireacht na Gearmáine ag an gComhdháil Idir­Rialtasach;
","OPUS QED, lines 19088 to 19097"
"Airteagal 120
Faoi réir na gcoinniollacha agus na dteorainneacha ama atá leagtha amach in Airteagail 121 go 126, féadfaidh na Ballstáit nua an léirscaoil­eadh ar ghluaiseachtaí caipitil a chur siar a bhforáiltear do leis an gcéad Treoir on gComhairle, dar data 11 Bealtaine 1960, chun Airteagal 67 de Chonradh CEE a chur i ngníomh agus leis an darà Treoir ón gComhairle, dar data 18 Nollaig 1962, ag comhlánú agus ag leasú na chéad Treorach chun Airteagal 67 de Chonradh CEE a chur i ngníomh.
Rachfar i ndáil chomhairle mar is gá, an tráth cui, idir na Ballstáit nua agus an Coimisiún maidir leis na modhanna chun bearta léirscaoilte nó maolaithe a chur i ngníomh ar féidir a bhfeidhm a chur siar de bhua na bhforálacha seo a leanas.
Airteagal 121
Féadfaidh an Danmhairg: a) léirscaoileadh a chur siar, ar feadh tréimhse dhá bhliain tar éis an aontachais. i gcás ceannach bannaí ag neamhchónaitheoiri, ar bannaí iad a rinneadh amach in Kroner na Danmhairge agus a ndéileáiltear iontu aran stocmhargadh sa Danmhairg. agus aistriú nithiúil na n­urrús thuasluaite á chur san áireamh: b) léirscaoileadh a chur siar, ar feadh tréimhse chúig bliana tar éis an aontachais, i gcás ceannach urrús coigríche, a ndéileáiltear iontu ar an stocmhargadh, ag cónaitheoirí sa Danmhairg, agus i gcás ath­cheannach ón gcoigrich ar urrúis Dhanmhargacha a ndéileáiltear iontu ar an stocmhargadh, a sonraíodh go hiomlán nó go páirleach in airgead coigríche. agus aistriú nithiúil na n­urrús thuasluaite á chur san áireamh.
Amhail ó dháta an aontachais, rachaidh an Danmhairg i gcionn léirscaoileadh comhleanúnach ar na hoibríochtaí dá dtagraítear i mir Ια).
Airteagal 122
Féadfaidh Éire: a) léirscaoileadh a chur siar. ar feadh tréimhse dhá bhliain tar éis an aontachais. i gcás infheistíochtaí díreacha sna Ballstáit ag cónaitheoírí in Éirinn agus i gcás réadú infheistíochtaí díreacha sna Ballstáit ag cónaitheoírí ín Éirinn;
Ih) léirscaoileadh a chur siar. ar feadh tréimhse tríocha mi lar éis an aontachais, i gcás gluaiseachtaí caipitil de chineál pearsanta mar a leanas:
","OPUS QED, lines 14447 to 14456"
"Forás inbhuanaithe: forbairt eacnamaíoch réigiúnach, gníomh chun forás, iomaíochas agus fostaíocht a chur chun cinn 382 Mrd EUR (44 %)
Caomhnú agus bainistiú acmhainní nádúrtha: talmhaíocht, forbairt inbhuanaithe agus an comhshaol 371 Mrd EUR (43 %)
BHAINISTIÚ A A
An AE ar an ardán domhanda: gníomh eachtrach, beartas forbraíochta, cabhair dhaonchairdiúil49 Mrd EUR (6 %)
Saoránacht, saoirse, slándáil agus ceartas: cosaint chearta na saoránach, saorghluaiseacht daoine, comhar póilíneachta agus breithiúnach, comhrac i gcoinne na sceimhlitheoireachta11 Mrd EUR (1 %)
Caiteachas eile, lena n-áirítear riarachán 51 Mrd EUR (6 %)
Forbairt eacnamaíoch inbhuanaithe a chur chun cinn ...
Baintear úsáid as cuid mhór de bhuiséad an Chomhphobail chun borradh a chur faoi fhorás eacnamaíoch agus chun éagothromaíocht idir réigiúin éagsúla na hEorpa a laghdú: caitear sciar mór den bhuiséad freisin ar thógáil mótarbhealaí agus iarnróid a nascann Ballstáit, ar chabhrú le gnólachtaí beaga agus ar thacú le taighde teicniúil agus tionscadail nuálachta (m.sh. chun cineálacha fuinnimh in-athnuaite a fhorbairt), etc.
Faigheann an Talmhaíocht, arb é an t-aon bheartas é a dhéantar a riaradh ina iomláine ar leibhéal an AE, sciar mór den bhuiséad.
","OPUS QED, lines 4688 to 4697"
"Mura dtugtar cinneadh ag gabháil leis. seasfaidh an modhnú a tairgeadh mar mhodhnú ar diúltaíodh dó;
— más rud é. de bhun forálacha cheann den dá fhomhír roimhe seo. go mbeidh an Chomhairle tar éis diúltú do mhodhnú a tairgeadh.
féadfaidh sí. ag gniomhú di tri thromlach cáilithe. an tsuim a thaispeántar sa dréachtbhuiséad a choinneáil nó suim eile a shocrú.
Modhnófar an dréachtbhuiséad de réir na modhnuithe a tairgeadh agus ar ghabh an Chomhairle leo.
Más rud é. laistigh de chúig lá dhéag ó cuireadh an dréachtbhuiséad sin faoina bráid. nach mbeidh an Chomhairle tar éis modhnú a dhéanamh ar aon cheann de na leasuithe lenar ghlac an Tionól agus má gabhadh leis na modhnuithe a thairg an Tionól. measfar go bhfuil glactha go críochnaitheach leis an mbuiséad.
Cuirfidh an Chomhairle i bhfios don Tionól nár mhodhnaigh sé aon cheann de na leasuithe agus gur gabhadh leis na modhnuithe a tairgeadh.
Más rud é. laistigh den tréimhse sin, go mbeidh an Chomhairle tar éis modhnú a dhéanamh ar cheann nó níos mó de na leasuithe lenar ghlac an Tionól nó má diúltaíodh do na modhnuithe a thairg an Tionól. nó má modhnaíodh iad, cuirfear an dréachtbhuiséad ama mhodhnú chuig an Tionól arís.
Cuirfidh an Chomhairle torthaí a pléití i bhfios don Tionól.
Laistigh de chúig lá dhéag tar éis an dréachtbhuiséad sin a chur faoina bhráid. agus fios tugtha dó ar cad a tharla i dtaobh na modhnuithe a thairg sé. féadfaidh an Tionól, ag gniomhú tri thromlach a chomhaltaí agus le tri chúigiú de na votai a caitheadh, modhnuithe na Comhairle ar leasuithe an Tionól a leasú nó a dhiúltú, agus glacfaidh sé leis an mbuiséad dá réir sin.
","OPUS QED, lines 8637 to 8646"
"Bainfidh an Conradh seo le Ríocht na Beilge, le Ríocht na Danmhairge, le Poblacht Chónaidhme na Gearmáine, le Poblacht na Fraince, le hÉirinn, le Poblacht na hlodáile, le hArdDiúiceacht Lucsamburg, le Ríocht na hísiltíre agus le Ríocht Aontaithe na Breataine Móire agus Thuaisceart Éireann.*
Mir 1 mar atá arna leasú le hAirteagal 26(1) den Ionstraim Aontachais, mar atá ama leasú le hAirteagal 15(1) den Chinneadh Oiriúnuithe.
Maidir leis an Ailgéir agus leis na ranna Francacha thar lear, beidh feidhm ag na forálacha ginearálta agus sonracha den Chonradh seo a bhaineann leis na nithe seo:
— saorghluaiseacht earraí ; — talmhaíocht, amach ó Airteagal 40(4); — léirscaoileadh seirbhisi; — na rialacha iomaíochta; — na bearta cosanta dá bhforáiltear in Airteagail 108, 109, agus 226; — na hinstitiúidí; a luaithe a thiocfaidh an Conradh seo i bhfeidhm.
Déanfar na coinníollacha faoina mbeidh feidhm ag forálacha eile an Chonartha seo a shocrú, laistigh de dhá bhliain tar éis an Chonradh seo a theacht i bhfeidhm, le cinntí ón gComhairle, ag gniomhú di d'aontoil ar thogra ón gCoimisiún.
Féachfaidh institiúidí an Chomhphobail chuige. faoi chuimsiú na nósanna imeachta dá bhforáiltear sa Chonradh seo. go háirithe in Air teagal 226. go mbeidh forbairt eacnamaíoch agus sóisialta na Iimistéar sin indéanta.
Bainfidh na socruithe speisialta i dtaobh comhlachais atá leagtha amach i gCuid a Ceathair den Chonradh seo leis na tíortha agus na críocha thar lear atá luaite sa liosta in Iarscribhinn IV a ghabhann leis an gConradh seo.
Ni bhainfidh an Conradh seo leis na tíortha agus na críocha thar lear a bhfuil caidreamh speisialta acu le Ríocht Aontaithe na Breataine Móire agus Thuaisceart Éireann agus nach bhfuil luaite sa liosta réamhráite. *
Bainfidh forálacha an Chonartha seo leis na críocha Eorpacha a bhfuil Ballstát freagrach ina gcaidreamh eachtrach.
","OPUS QED, lines 8798 to 8807"
"Déanfar an praghas ar a ndioltar an siúcra atá i geeist ar mhargadh na Riochta Aontaithe a shocrú ar leibhéal a áiritheoidh go ndíolfar na cainniochtaí atá i geeist go héifeachtúíl gan dochar do dhíolacháin siúcra an Chomhphobail.
De mhaolú ar na forálacha atá leagtha síos in Airteagal 15(1) de Rialachán (CEE) Uimh.
766/68 ag bunú rialacha ginearálta i dtaobh aisíocaíochtai ar onnmhairí siúcra, féadfar an t-aisíoc ar onnmhairí is infheidhme sa Ríocht Aontaithe a dheonú i gcás siúcra bán a gheofar as siúcra amh a allmhaireofar de bhun an Phrótacail seo.
Glacfaidh an Chomhairle, ag gniomhú di tri thromlach cáilithe ar thogra ón gCoimisiún, na bearta is gá chun forálacha an Phrótacail seo a chur i ngníomh ar mhodh a áiritheoidh dea-oibriú chomheagraíocht mhargadh an tsiúcra, go háirithe maidir le praghas díola an tsiúcra sin ar mhargadh na Riochta Aontaithe tráth feidhmiú na bhforálacha atá leaghta síos i mir 2.
18 ar allmhairí ime agus cáise ón Nua-Sbéalainn isteach sa Ríocht Aontaithe
Airteagal 1
Üdaraítear don Ríocht Aontaithe, faoi na coinníollacha seo a leanas agus mar shocrú sealadach, cainniochtaí áirithe ime agus cáise a all­mhairiú ón Nua­Shéalainn.
Is é méid na gcainníochtaí dá dtagraítear i mir 1 : α) maidir le him, do na chéad chúig bliana:
1973, 165 811 tonna méadrach 1974, 158 902 tonna méadrach 1975, 151 994 tonna méadrach 1976, 145 085 tonna méadrach i 1977, 138 176 tonna méadrach b) maidir le cáis:
","OPUS QED, lines 14947 to 14956"
"Dearbhú maidir le hAirteagal 100 den Chonradh ag bunú an Chomhphobail Eorpaigh
Dearbhú maidir le hAirteagal 111 den Chonradh ag bunú an Chomhphobail Eorpaigh
Dearbhú maidir le hAirteagal 137 den Chonradh ag bunú an Chomhphobail Eorpaigh
Dearbhú maidir le hAirteagal 175 den Chonradh ag bunú an Chomhphobail Eorpaigh
Dearbhú maidir le hAirteagal 181a den Chonradh ag bunú an Chomhphobail Eorpaigh
Dearbhú maidir le hAirteagal 191 den Chonradh ag bunú an Chomhphobail Eorpaigh
Dearbhú maidir le hAirteagal 225 den Chonradh ag bunú an Chomhphobail Eorpaigh
Dearbhú maidir le hAirteagal 225(2) agus (3) den Chonradh ag bunú an Chomhphobail Eorpaigh
Dearbhú maidir le hAirteagal 225(2) agus (3) den Chonradh ag bunú an Chomhphobail Eorpaigh
","OPUS QED, lines 19891 to 19900"
"""Airteagal 136
Áiritheoidh an Chúirt Bhreithiúnais agus an Chúirt Chéadchéime, faoi chuimsiú a ndlínsí faoi seach, go gcomhlíonfar an dlí i léiriú an Chonartha seo agus ina chur chun feidhme.
Ina theannta sin, féadfar painéil bhreithiúnacha a chur ag gabháil leis an gCúirt Chéadchéime faoi na coinníollacha ata leagtha síos in Airteagal 140b chun an inniúlacht bhreithiúnach dá bhforáiltear sa Chonradh seo a fheidhmiú i réimsí sonracha áirithe.""
Cuirtear an méid seo a leanas in ionad Airteagal 137:
""Airteagal 137
Breitheamh amháin in aghaidh an Bhallstáit a bheidh ar an gCúirt Bhreithiúnais.
Suífidh an Chúirt Bhreithiúnais i ndlísheomraí nó i Mór-Dhlísheomra i gcomhréir leis na rialacha ama mbunú chuige sin i Reacht na Cúirte Breithiúnais.
Féadfaidh an Chúirt Bhreithiúnais sui mar chúirt iomlán freisin nuair a fhoráiltear dò sin sa Reacht.""
CUID A hAON
","OPUS QED, lines 20485 to 20494"
"Fisic theoiriciúil fheidhmeach:
(a) imoibrithe núicléacha lagfhuinnimh, go háirithe imoibrithe a ionduchtaíodh le neodróin;
(b) scoilteadh;
(c) imoibriú radaíochta ianúcháin agus fotón le damhna;
(d) teoiric na staide soladaí;
(e) staidéar ar chomhleá, go háirithe maidir le hiompraíocht phlasma ianaithe faoi oibriú fórsai leictreamaighnéadacha agus le teirmidinimic teochtai fiorarda.
Fisic thurgnamhach fheidhmeach: (a) na hábhair a shonraítear in 1 thuas;
(b) staidéar ar airíonna dúile trasúráineacha a bhfuil tábhacht leo i réimse an fhuinnimh núicléach.
Ríomhaireachtaí imoibritheora: (a) fisic theoiriciúil mhacrascapach neodrón;
","OPUS QED, lines 18843 to 18852"
